{
  "schema_version": "RANGEMATCH_ADVISOR_LLM_WORKBENCH@0.1.0",
  "packet_hash": "5269b7dc8e3bd112675d63e1485c3152e8b12260b2a26ccb1bfd2cc07cdeeaba",
  "report_locale": "en-US",
  "audience": "ORDINARY_BUYER",
  "visit_purpose": "VISIT_DEPENDS_ON_DOCUMENT",
  "observations": [
    {
      "observation_id": "OBS_PRECIP",
      "label": "Mean annual precipitation",
      "value": 345.74,
      "unit": "mm/year",
      "time_period": null,
      "evidence_state": "MEASURED",
      "allowed_support": [
        "canonical climate lookup is complete"
      ],
      "prohibited_support": [
        "climate adequacy",
        "drought resilience",
        "future performance"
      ]
    },
    {
      "observation_id": "OBS_SLOPE",
      "label": "Median slope",
      "value": 2.395727249934432,
      "unit": "degree",
      "time_period": null,
      "evidence_state": "PARCEL_DERIVED",
      "allowed_support": [
        "gentle typical slope context"
      ],
      "prohibited_support": [
        "suitability",
        "traversability for every animal"
      ]
    },
    {
      "observation_id": "OBS_AREA",
      "label": "Mapped geometric area",
      "value": 1404078.7002779155,
      "unit": "m2",
      "time_period": null,
      "evidence_state": "PARCEL_DERIVED",
      "allowed_support": [
        "mapped outline size"
      ],
      "prohibited_support": [
        "grazable acres",
        "fencing cost",
        "survey"
      ]
    },
    {
      "observation_id": "OBS_RAP_PROD",
      "label": "Modeled annual herbaceous production",
      "value": 937.6780475452124,
      "unit": "pound_per_acre",
      "time_period": "annual_accumulated_new_growth_2025",
      "evidence_state": "MODELED",
      "allowed_support": [
        "modeled vegetation snapshot"
      ],
      "prohibited_support": [
        "available forage",
        "carrying capacity",
        "ready for cattle"
      ]
    },
    {
      "observation_id": "OBS_WATER_COUNT",
      "label": "Mapped hydrography candidate count",
      "value": 9,
      "unit": "count",
      "time_period": null,
      "evidence_state": "MAPPED_CANDIDATE",
      "allowed_support": [
        "mapped water features exist as leads"
      ],
      "prohibited_support": [
        "usable livestock water",
        "year-round reliability",
        "legal right"
      ]
    },
    {
      "observation_id": "OBS_ROAD",
      "label": "Nearest mapped road distance",
      "value": 0.0,
      "unit": "m",
      "time_period": null,
      "evidence_state": "MAPPED_CANDIDATE",
      "allowed_support": [
        "physical road contact on the map"
      ],
      "prohibited_support": [
        "legal access",
        "usable entrance"
      ]
    }
  ],
  "claim_gaps": [
    {
      "claim_id": "CLAIM_WATER_001",
      "claim": "Excellent year-round water",
      "supported_portion": "Mapped hydrography candidates exist on the tract",
      "unsupported_portion": [
        "year-round reliability",
        "livestock accessibility",
        "capacity",
        "quality",
        "legal right"
      ],
      "risk_of_misreading": "HIGH",
      "recommended_action_id": "ACTION_WATER_FIELD_CATEGORY",
      "recommended_message_id": "MSG_LISTING_WATER"
    },
    {
      "claim_id": "CLAIM_ACCESS_001",
      "claim": "Easy county-road access",
      "supported_portion": "A mapped road contacts the geometry",
      "unsupported_portion": [
        "legal entrance",
        "recorded easement",
        "buyer right to use"
      ],
      "risk_of_misreading": "HIGH",
      "recommended_action_id": "ACTION_ACCESS_DOCUMENTS",
      "recommended_message_id": "MSG_TITLE_ACCESS"
    },
    {
      "claim_id": "CLAIM_FORAGE_001",
      "claim": "Productive pasture ready for cattle",
      "supported_portion": "RAP returned a modeled production snapshot",
      "unsupported_portion": [
        "available forage",
        "carrying capacity",
        "ready for cattle"
      ],
      "risk_of_misreading": "HIGH",
      "recommended_action_id": null,
      "recommended_message_id": null
    }
  ],
  "candidate_objects": [
    {
      "candidate_id": "USGS_NHDPLUS_HR:NHDWaterbody:120639594",
      "candidate_type": "WATERBODY",
      "display_name": null,
      "review_status": "SAMPLED",
      "evidence_state": "MAPPED_CANDIDATE",
      "field_navigation_precision": "AREA_ONLY"
    },
    {
      "candidate_id": "USGS_NHDPLUS_HR:NetworkNHDFlowline:120638829",
      "candidate_type": "FLOWLINE",
      "display_name": null,
      "review_status": "SAMPLED",
      "evidence_state": "REMOTELY_SUPPORTED",
      "field_navigation_precision": "AREA_ONLY"
    },
    {
      "candidate_id": "USGS_NHDPLUS_HR:NetworkNHDFlowline:120638830",
      "candidate_type": "FLOWLINE",
      "display_name": "Little Owl Creek",
      "review_status": "SAMPLED",
      "evidence_state": "REMOTELY_SUPPORTED",
      "field_navigation_precision": "AREA_ONLY"
    },
    {
      "candidate_id": "USGS_NHDPLUS_HR:NetworkNHDFlowline:120638838",
      "candidate_type": "FLOWLINE",
      "display_name": "Little Owl Creek",
      "review_status": "UNREVIEWED",
      "evidence_state": "MAPPED_CANDIDATE",
      "field_navigation_precision": "NOT_NAVIGABLE"
    },
    {
      "candidate_id": "USGS_NHDPLUS_HR:NetworkNHDFlowline:120638842",
      "candidate_type": "FLOWLINE",
      "display_name": "Little Owl Creek",
      "review_status": "UNREVIEWED",
      "evidence_state": "MAPPED_CANDIDATE",
      "field_navigation_precision": "NOT_NAVIGABLE"
    },
    {
      "candidate_id": "USGS_NHDPLUS_HR:NetworkNHDFlowline:156614082",
      "candidate_type": "FLOWLINE",
      "display_name": null,
      "review_status": "UNREVIEWED",
      "evidence_state": "MAPPED_CANDIDATE",
      "field_navigation_precision": "NOT_NAVIGABLE"
    },
    {
      "candidate_id": "USGS_NHDPLUS_HR:NetworkNHDFlowline:156614135",
      "candidate_type": "FLOWLINE",
      "display_name": null,
      "review_status": "UNREVIEWED",
      "evidence_state": "MAPPED_CANDIDATE",
      "field_navigation_precision": "NOT_NAVIGABLE"
    },
    {
      "candidate_id": "USGS_NHDPLUS_HR:NetworkNHDFlowline:156614136",
      "candidate_type": "FLOWLINE",
      "display_name": "Little Owl Creek",
      "review_status": "UNREVIEWED",
      "evidence_state": "MAPPED_CANDIDATE",
      "field_navigation_precision": "NOT_NAVIGABLE"
    },
    {
      "candidate_id": "USGS_NHDPLUS_HR:NonNetworkNHDFlowline:156614070",
      "candidate_type": "FLOWLINE",
      "display_name": null,
      "review_status": "UNREVIEWED",
      "evidence_state": "MAPPED_CANDIDATE",
      "field_navigation_precision": "NOT_NAVIGABLE"
    }
  ],
  "bottleneck_candidates": [
    {
      "bottleneck_id": "BOTTLENECK_WATER_EVIDENCE",
      "bottleneck_rank": 1,
      "title": "Livestock-water use is the larger operating-evidence gap",
      "decision_impact": "HIGH",
      "information_gain": "HIGH",
      "cost_class": "FIELD_HALF_DAY"
    },
    {
      "bottleneck_id": "BOTTLENECK_LEGAL_ACCESS",
      "bottleneck_rank": 2,
      "title": "Legal entrance is unproven",
      "decision_impact": "HIGH",
      "information_gain": "HIGH",
      "cost_class": "DOCUMENT_REQUEST"
    },
    {
      "bottleneck_id": "BOTTLENECK_FORAGE_LEAP",
      "bottleneck_rank": 3,
      "title": "Modeled growth must not be read as stockable forage",
      "decision_impact": "MEDIUM",
      "information_gain": "MEDIUM",
      "cost_class": "DESKTOP"
    }
  ],
  "action_candidates": [
    {
      "action_id": "ACTION_ACCESS_DOCUMENTS",
      "execution_order": 1,
      "action_type": "DOCUMENT_REQUEST",
      "cost_class": "DESKTOP",
      "can_establish": [
        "documentary basis for claimed access"
      ],
      "cannot_establish": [
        "road condition",
        "seasonal passability",
        "final legal interpretation"
      ],
      "role": "PACKET"
    },
    {
      "action_id": "ACTION_WATER_FIELD_CATEGORY",
      "execution_order": 2,
      "action_type": "FIELD_REVIEW",
      "cost_class": "FIELD_HALF_DAY",
      "can_establish": [
        "whether mapped water features show visible water and access signs on the visit date"
      ],
      "cannot_establish": [
        "year-round reliability",
        "water quality",
        "legal right to use"
      ],
      "role": "PACKET"
    },
    {
      "action_id": "ACTION_REPEAT_PRECIP",
      "action_type": "DOCUMENT_REQUEST",
      "cost_class": "DESKTOP",
      "role": "DEFERRED_COMPARISON",
      "why_now": "Annual precipitation is already measured; a repeat lookup does not change the current decision.",
      "can_establish": [],
      "cannot_establish": [
        "whether a weekend visit has a job"
      ]
    }
  ],
  "action_policy": {
    "allowed_first_actions": [
      "ACTION_ACCESS_DOCUMENTS"
    ],
    "action_dependencies": {
      "ACTION_WATER_FIELD_CATEGORY": [
        "ACTION_ACCESS_DOCUMENTS"
      ]
    },
    "allowed_permutations": null
  },
  "execution_order": [
    "ACTION_ACCESS_DOCUMENTS",
    "ACTION_WATER_FIELD_CATEGORY"
  ],
  "knowledge_cards": [
    {
      "knowledge_id": "FIELD_TASK_BOUNDARY_001",
      "topic": "field_task_boundary",
      "statement": "A field walk can record what is visible on the visit date in mapped water areas or seller-named places. It cannot prove year-round reliability, water quality, legal right, or stocking. If access paper has not supported an entrance, do not send the trip.",
      "source_id": "SRC_FIELD_BOUND_001",
      "source_title": "What a ranch visit can and cannot establish",
      "source_url_or_citation": "docs/ADVISOR_INSIGHT_AND_REASONING_CONTRACT.md",
      "source_publisher": "RangeMatch Advisor contract",
      "source_date": "2026-08-12",
      "reviewed_by": "RangeMatch product review",
      "reviewed_at": "2026-08-12",
      "review_basis": "Bound to visit-purpose rails already in the Advisor contract.",
      "effective_jurisdictions": [
        "US_GENERAL"
      ],